{
  "id": "harvard-cs50p",
  "name": "CS50's Introduction to Programming with Python",
  "institution": "Harvard University",
  "term": "2022",
  "license_note": "CS50 materials are Creative Commons BY-NC-SA on cs50.harvard.edu; this pack contains links only.",
  "sources": [
    {
      "kind": "website",
      "url": "https://cs50.harvard.edu/python/2022/",
      "max_depth": 2,
      "max_pages": 50,
      "include_prefix": "https://cs50.harvard.edu/python/"
    },
    {
      "kind": "youtube",
      "url": "https://www.youtube.com/playlist?list=PLhQjrBD2T3817j24-GogXmWqO5Q5vYy0V",
      "title": "CS50P 2022 Lectures"
    }
  ],
  "topics": [
    {
      "lecture": 0,
      "title": "Functions, Variables",
      "topics": [
        "Functions, Variables",
        "Functions",
        "Variables"
      ]
    },
    {
      "lecture": 1,
      "title": "Conditionals",
      "topics": [
        "Conditionals"
      ]
    },
    {
      "lecture": 2,
      "title": "Loops",
      "topics": [
        "Loops"
      ]
    },
    {
      "lecture": 3,
      "title": "Exceptions",
      "topics": [
        "Exceptions"
      ]
    },
    {
      "lecture": 4,
      "title": "Libraries",
      "topics": [
        "Libraries"
      ]
    },
    {
      "lecture": 5,
      "title": "Unit Tests",
      "topics": [
        "Unit Tests",
        "Unit tests"
      ]
    },
    {
      "lecture": 6,
      "title": "File I/O",
      "topics": [
        "File I/O"
      ]
    },
    {
      "lecture": 7,
      "title": "Regular Expressions",
      "topics": [
        "Regular Expressions",
        "Regular expressions"
      ]
    },
    {
      "lecture": 8,
      "title": "Object-Oriented Programming",
      "topics": [
        "Object-Oriented Programming",
        "Object-oriented programming",
        "Classes"
      ]
    },
    {
      "lecture": 9,
      "title": "Et Cetera",
      "topics": [
        "Et Cetera"
      ]
    }
  ],
  "schema": 1,
  "maintainers": [
    "verdent06"
  ],
  "version": "1.0.0"
}
