{
  "schema": 1,
  "id": "mini",
  "name": "Mini Automata Fixture",
  "institution": "CourseCopilot Fixtures",
  "term": "F26",
  "license_note": "Original sample text for tests; links only in this pack.",
  "maintainers": ["verdent06"],
  "version": "1.0.0",
  "sources": [
    {
      "kind": "website",
      "url": "https://example.edu/eecs3760/",
      "max_depth": 2,
      "max_pages": 40
    },
    {
      "kind": "youtube",
      "url": "https://www.youtube.com/playlist?list=PLtestplaylist1xx"
    }
  ],
  "topics": [
    {
      "lecture": 7,
      "title": "Pumping lemma",
      "topics": ["Pumping lemma", "Nonregular languages"]
    }
  ],
  "exams": [{ "name": "Midterm", "topics": ["Pumping lemma"] }]
}
